ListingID,Category,ItemName,PriceTHB,Condition,PickupArea,DatePosted,SellerType,Status,Description
GL-001,Furniture,Wooden study desk,800,Good,Dorm A lobby,2026-06-20,Graduating student,Available,Solid desk with drawer. Must go before June 30 flight.
GL-002,Appliances,Mini fridge 45L,1500,Like new,Building 6,2026-06-21,International student,Reserved,Used one semester. Includes small freezer box.
GL-003,Textbooks,ICT111 Introduction to IT textbook,250,Good,ICT building,2026-06-21,Second-year student,Available,Light highlights in chapters 1-4.
GL-004,Furniture,Office chair with wheels,450,Fair,Dorm B,2026-06-22,Graduating student,Sold,Small scratch on armrest. Very comfortable.
GL-005,Appliances,Electric kettle 1.5L,200,Good,Dorm A,2026-06-23,Dorm resident,Available,Boils fast. Selling because moving to condo with kitchen.
GL-006,Furniture,4-tier bookshelf,600,Good,Condo near Gate 4,2026-06-24,International student,Available,Easy to disassemble for transport.
GL-007,Other,LED desk lamp,150,Like new,Library meetup,2026-06-25,First-year student,Sold,Warm and white light modes. USB powered.
GL-008,Textbooks,Calculus textbook set (2 books),400,Like new,Library meetup,2026-06-26,Second-year student,Reserved,Barely used. Answers booklet included.
